{
  "response_receipt_id": "RR:ollama_real_first_run",
  "receiver_version": "v0.1",
  "kernel_contract_version": "v0.1",
  "kernel_run_id": "KR:ollama_real_first_run",
  "export_packet_id": "EK:first_run:v1",
  "prompt_receipt_id": "PR:ollama_real_first_run",
  "provider": "ollama",
  "model_name": "Hermes 3 Llama 3.2 3B",
  "declared_lens": "medium FFT / Hann baseline",
  "query_class": "Q3",
  "claim_class_ceiling": "L1",
  "legal_posture": "Read-side Language Kernel response only. No canon authority. Not structural truth. Not primary retention substance.",
  "raw_response_hash_sha256": "b19da8a73b139bbdc3d2f924833f91d119fe05d9ab617c426bc3e3cae0e6cd6f",
  "raw_response_bytes": 990,
  "response_status": "received",
  "parse_status": "parsed",
  "schema_status": "conformant",
  "frame_count": 1,
  "receiver_flags": [
    "json_only_expected",
    "parsed_cleanly",
    "schema_checked"
  ],
  "conformance_outcome": "contract_conformant",
  "receiver_notes": [
    "operation_mode=contract_conformance_mode",
    "prompt_sha256=fd388283f6ffcca7ac3721388ad203a9124343d6ae3d77ba66fc04289f624db1",
    "Response parsed cleanly and satisfied the reasoning frame contract."
  ],
  "received_at": "2026-04-07T10:12:18Z",
  "frame_ids": [
    "LF:8d7e1f2g3h4"
  ],
  "legal_claim_present": true,
  "what_next_present": true
}
