{
  "response_receipt_id": "RR:manual:third_and_final_manual_run",
  "receiver_version": "v0.1",
  "kernel_contract_version": "v0.1",
  "kernel_run_id": "KR:manual:third_and_final_manual_run",
  "export_packet_id": "EK:first_run:v1",
  "prompt_receipt_id": "PR:manual:third_and_final_manual_run",
  "provider": "ollama",
  "model_name": "Meta Llama 3.1 8B Instruct",
  "declared_lens": "medium FFT / Hann baseline",
  "query_class": "Q3",
  "claim_class_ceiling": "L1",
  "legal_posture": "Read-side Language Kernel response only. No canon authority. Not structural truth. Not primary retention substance.",
  "raw_response_hash_sha256": "09dabe63ec9bd52a0d7677f9b03bc6384fdb4a4e3b486fa0d47b1adadf35034a",
  "raw_response_bytes": 560,
  "response_status": "received",
  "parse_status": "parsed",
  "schema_status": "nonconformant",
  "frame_count": 1,
  "receiver_flags": [
    "json_only_expected",
    "near_valid_incomplete_frame",
    "schema_checked"
  ],
  "conformance_outcome": "downgraded_near_valid_incomplete_frame",
  "receiver_notes": [
    "operation_mode=contract_conformance_mode",
    "prompt_sha256=6b38e4c7e5450c72a9b5915f2040d8a7f25ade67c6375fcff6be337abaac8414",
    "$: missing required property 'frame_type'",
    "Frames preserved exact literals but still missed required contract fields."
  ],
  "received_at": "2026-04-07T10:11:32Z",
  "frame_ids": [
    "LF:export_packet:1"
  ],
  "legal_claim_present": true,
  "what_next_present": true
}
