{
  "response_receipt_id": "RR:manual:first_run",
  "receiver_version": "v0.1",
  "kernel_contract_version": "v0.1",
  "kernel_run_id": "KR:manual:first_run",
  "export_packet_id": "EK:first_run:v1",
  "prompt_receipt_id": "PR:manual:first_run",
  "provider": "ollama",
  "model_name": "Hermes 3 Llama 3.2 3B",
  "declared_lens": "medium FFT / Hann baseline",
  "query_class": "Q3",
  "claim_class_ceiling": "L1",
  "legal_posture": "Read-side Language Kernel response only. No canon authority. Not structural truth. Not primary retention substance.",
  "raw_response_hash_sha256": "64d93711b3552e5391ec839e8ba1754ac3802bb344e9722486dceec20caa6c8d",
  "raw_response_bytes": 332,
  "response_status": "received",
  "parse_status": "partial_json",
  "schema_status": "nonconformant",
  "frame_count": 0,
  "receiver_flags": [
    "json_only_expected",
    "extra_prose_leakage",
    "schema_checked",
    "nested_wrong_shape_output",
    "empty_first_turn_frame_list"
  ],
  "conformance_outcome": "aborted_nested_wrong_shape_output",
  "receiver_notes": [
    "operation_mode=contract_conformance_mode",
    "prompt_sha256=6b38e4c7e5450c72a9b5915f2040d8a7f25ade67c6375fcff6be337abaac8414",
    "Extra prose leaked outside the JSON object.",
    "language_frames contained a nested object instead of the required array.",
    "Nested wrong-shape payload also carried an empty first-turn frame list.",
    "Wrong-shape envelope also leaked prose outside JSON."
  ],
  "received_at": "2026-04-07T09:38:28Z",
  "refusal_reason": "nested wrong-shape language_frames envelope"
}
